{
  "APP_ENV": "prod",
  "APP_ID": "me.newlines.kinflow",
  "APP_VERSION": "0.2.0-alpha.1+2",
  "CONTRACT_VERSION": "2026-07-25",
  "SUPABASE_URL": "https://example.invalid",
  "SUPABASE_PUBLISHABLE_KEY": "replace-with-prod-publishable-key",
  "GOOGLE_WEB_CLIENT_ID": "replace-with-prod-web-client-id.apps.googleusercontent.com",
  "REVENUECAT_ANDROID_PUBLIC_SDK_KEY": "",
  "SENTRY_DSN": "",
  "PUBLIC_SITE_URL": "https://example.invalid",
  "AUTH_REDIRECT_HOST": "auth.example.invalid",
  "SUPPORT_URL": "https://example.invalid/support",
  "PRIVACY_REQUEST_URL": "https://example.invalid/privacy-request",
  "FEATURE_CONFIG_URL": "",
  "FIREBASE_ANDROID_API_KEY": "",
  "FIREBASE_ANDROID_APP_ID": "",
  "FIREBASE_MESSAGING_SENDER_ID": "",
  "FIREBASE_PROJECT_ID": ""
}
